{
  "id": "web-engineering",
  "title": "Web Engineering",
  "professors": ["Dr. Elena Pavel"],
  "description": "Modern frontend architecture and delivery.",
  "materials": [
    {
      "id": "web-course-01",
      "type": "course",
      "title": "HTTP and Browser Runtime",
      "url": "https://example.edu/web/http",
      "addedAt": "2026-06-01T08:00:00.000Z"
    }
  ],
  "assignmentDeadlines": [],
  "courseSessions": [
    {
      "id": "web-l1",
      "title": "Browser Architecture",
      "startsAt": "2026-10-05T08:00:00.000Z",
      "endsAt": "2026-10-05T10:00:00.000Z",
      "location": "Lab W1",
      "status": "scheduled",
      "addedAt": "2026-06-02T09:00:00.000Z"
    }
  ],
  "exams": []
}
